{
  "$schema": "https://json-schema.org/draft/2020-12/schema",
  "$id": "urn:jps:proposal:policy-companion:1.0.0:fixture",
  "title": "Local synthetic candidate fixture carrier; not a release envelope",
  "type": "object",
  "additionalProperties": false,
  "required": [
    "fixtureVersion",
    "synthetic",
    "scenario",
    "materials",
    "policy",
    "consumer",
    "adoption"
  ],
  "properties": {
    "fixtureVersion": {
      "const": "1"
    },
    "synthetic": {
      "const": true
    },
    "scenario": {
      "type": "string",
      "minLength": 1,
      "maxLength": 128
    },
    "materials": {
      "type": "array",
      "minItems": 1,
      "maxItems": 16,
      "items": {
        "type": "object",
        "additionalProperties": false,
        "required": [
          "path",
          "content"
        ],
        "properties": {
          "path": {
            "type": "string",
            "minLength": 1,
            "maxLength": 128
          },
          "content": {
            "$ref": "urn:jps:proposal:policy-companion:1.0.0:common#/$defs/retainedContent"
          }
        }
      }
    },
    "policy": {
      "type": "string",
      "minLength": 1,
      "maxLength": 128
    },
    "consumer": {
      "type": "string",
      "minLength": 1,
      "maxLength": 128
    },
    "adoption": {
      "type": "string",
      "minLength": 1,
      "maxLength": 128
    }
  }
}
